{
  "command_id": "018f8c7c-0020-7020-8020-000000000020",
  "command_type": "SUBMIT_ORDER",
  "schema_version": 1,
  "submission_state": "SUBMISSION_QUEUED",
  "order_intent_id": "018f8c7c-0021-7021-8021-000000000021",
  "client_order_id": "018f8c7c-0022-7022-8022-000000000022",
  "account_id": "018f8c7c-0023-7023-8023-000000000023",
  "venue_id": "018f8c7c-0024-7024-8024-000000000024",
  "instrument_id": "018f8c7c-0025-7025-8025-000000000025",
  "strategy_instance_id": "018f8c7c-0026-7026-8026-000000000026",
  "deployment_id": "018f8c7c-0027-7027-8027-000000000027",
  "correlation_id": "018f8c7c-0028-7028-8028-000000000028",
  "causation_id": "018f8c7c-0029-7029-8029-000000000029",
  "trace_id": "018f8c7c-0030-7030-8030-000000000030",
  "side": "BUY",
  "order_type": "LIMIT",
  "quantity": "0.01000000",
  "limit_price": "60000.00",
  "trigger_price": null,
  "time_in_force": "GTC",
  "reduce_only": false,
  "post_only": false,
  "created_at": "2026-07-31T00:00:00Z",
  "expires_at": "2026-07-31T00:05:00Z",
  "strategy_version": "example-strategy.v1",
  "config_hash": "sha256:0123456789abcdef0123456789abcdef0123456789abcdef0123456789abcdef",
  "input_snapshot_ref": "snapshot://fixture/non-secret-input-v1",
  "risk_decision": {
    "decision": "APPROVE",
    "risk_policy_id": "018f8c7c-0031-7031-8031-000000000031",
    "risk_policy_version": "paper-risk.v1",
    "reservation_id": "018f8c7c-0032-7032-8032-000000000032",
    "portfolio_snapshot_hash": "sha256:0123456789abcdef0123456789abcdef0123456789abcdef0123456789abcdef",
    "market_snapshot_hash": "sha256:0123456789abcdef0123456789abcdef0123456789abcdef0123456789abcdef",
    "input_hash": "sha256:0123456789abcdef0123456789abcdef0123456789abcdef0123456789abcdef",
    "decided_at": "2026-07-31T00:00:00Z",
    "expires_at": "2026-07-31T00:01:00Z"
  },
  "manual_approval_ref": null,
  "venue_capability_profile_checksum": "sha256:0123456789abcdef0123456789abcdef0123456789abcdef0123456789abcdef",
  "canonical_request_hash": "sha256:0123456789abcdef0123456789abcdef0123456789abcdef0123456789abcdef"
}
